{
  "schemaVersion": 2,
  "id": "kimi-cli",
  "displayName": "Kimi Code CLI",
  "kind": "cli",
  "binary": {
    "windows": [
      "kimi"
    ],
    "macos": [
      "kimi"
    ],
    "linux": [
      "kimi"
    ]
  },
  "isolation": {
    "strategy": "accountOverlay",
    "mode": "foreground",
    "env": {
      "KIMI_CODE_HOME": "{sharedStateRoot}"
    },
    "clearEnv": []
  },
  "account": {
    "mechanism": "processSecret",
    "credentialFiles": [],
    "credentialPrecedence": [
      "KIMI_MODEL_API_KEY with explicit model/provider selection"
    ],
    "logoutScope": "process",
    "secret": {
      "environmentVariable": "KIMI_MODEL_API_KEY"
    }
  },
  "normalState": {
    "root": {
      "windows": "%USERPROFILE%\\.kimi-code",
      "macos": "$HOME/.kimi-code",
      "linux": "$HOME/.kimi-code"
    },
    "sharedPaths": [
      "config.toml",
      "tui.toml",
      "mcp.json"
    ],
    "sessionPaths": [],
    "filePaths": [
      "config.toml",
      "tui.toml",
      "mcp.json"
    ],
    "unsafePaths": []
  },
  "concurrency": {
    "level": "multiWriter",
    "singletonScope": "backgroundService"
  },
  "support": {
    "windows": {
      "level": "supported",
      "reason": "process token (KIMI_MODEL_API_KEY) via nini-agents auth set"
    },
    "macos": {
      "level": "supported"
    },
    "linux": {
      "level": "supported"
    }
  },
  "install": "https://www.kimi.com/code/docs/en/kimi-code-cli/",
  "versionCommand": [
    "--version"
  ]
}
